author;title;description;url;date
MarketBeat News;XTX Topco Ltd Invests $272,000 in Enterprise Financial Services Corp (NASDAQ:EFSC);XTX Topco Ltd bought a new stake in Enterprise Financial Services Corp (NASDAQ:EFSC – Free Report) in the 3rd quarter, according to its most recent filing with the SEC. The fund bought 5,315 shares of the bank’s stock, valued at approximately $272,000. A numb…;https://www.etfdailynews.com/2024/12/19/xtx-topco-ltd-invests-272000-in-enterprise-financial-services-corp-nasdaqefsc/;2024-12-19T09:46:54Z
;Pugilato: Usyk-Fury, un giudice sarà l'intelligenza artificiale;Un annuncio quantomeno sorprendente, e che in futuro potrebbe rivoluzionare il mondo del pugilato, arriva da Riad, dove sabato, sul ring della Kingdom Arena, è in programma la rivincita del Mondiale Wbc-Wba-Wbo dei pesi massimi tra Oleksandr Usyk e Tyson F...…;https://www.ansa.it/sito/notizie/sport/altrisport/2024/12/19/pugilato-usyk-fury-un-giudice-sara-lintelligenza-artificiale_6b86410a-2756-4bbe-b09e-4fb548e9458e.html;2024-12-19T09:46:35Z
;Fórmula 1: Red Bull anunció a Liam Lawson como reemplazo de Checo Pérez;De esta manera, el neozelandés se convierte en compañero de Max Verstappen en la temporada 2025;https://www.lanacion.com.ar/deportes/automovilismo/formula-1-red-bull-anuncio-a-liam-lawson-como-reemplazo-de-checo-perez-nid19122024/;2024-12-19T09:45:17Z
MarketBeat News;Barclays PLC Purchases 38,027 Shares of Palomar Holdings, Inc. (NASDAQ:PLMR);Barclays PLC boosted its position in Palomar Holdings, Inc. (NASDAQ:PLMR – Free Report) by 112.6% during the 3rd quarter, according to the company in its most recent disclosure with the Securities & Exchange Commission. The fund owned 71,803 shares of the com…;https://www.etfdailynews.com/2024/12/19/barclays-plc-purchases-38027-shares-of-palomar-holdings-inc-nasdaqplmr/;2024-12-19T09:39:07Z
Salvo Privitera;Qual è l'acido più potente al mondo? Questo può sciogliere anche il vetro;Scopri il superacido trilioni di volte più forte dell'acido solforico e il suo potere di trasformare la chimica.Tra le meraviglie della chimica c’è un composto capace di ridefinire il concetto di corrosività: l’acido fluoroantimonico. Questa miscela di fluoru…;https://tech.everyeye.it/notizie/qual-acido-potente-mondo-sciogliere-vetro-762783.html;2024-12-19T09:38:00Z
BL Bengaluru Bureau;Velocity launches ₹200 crore fund to boost restaurants on food platforms in India;Velocity earmarks ₹200 crore to support F&B growth in India, offering cash-flow financing for restaurants and cloud kitchens.;https://www.thehindubusinessline.com/companies/velocity-launches-200-crore-fund-to-boost-restaurants-on-food-platforms-in-india/article69003375.ece;2024-12-19T09:37:55Z
MarketBeat News;M&T Bank Corp Acquires 66 Shares of Charles River Laboratories International, Inc. (NYSE:CRL);M&T Bank Corp grew its holdings in Charles River Laboratories International, Inc. (NYSE:CRL – Free Report) by 3.4% in the 3rd quarter, according to its most recent disclosure with the Securities and Exchange Commission (SEC). The institutional investor owned …;https://www.etfdailynews.com/2024/12/19/mt-bank-corp-acquires-66-shares-of-charles-river-laboratories-international-inc-nysecrl/;2024-12-19T09:37:24Z
Nithya P Nair, Siddharth Suvarna;"Xiaomi 15 Ultra Allegedly Spotted on MIIT Site; Could Offer Satellite Connectivity";Xiaomi 15 Ultra is likely to be unveiled early next year as the third model in the Xiaomi 15 series. While we await an official announcement, the upcoming handset has surfaced on China's Ministry of Industry and Information Technology (MIIT) website with mode…;https://www.gadgets360.com/mobiles/news/xiaomi-15-ultra-miit-certification-site-satellite-connectivity-report-7284449;2024-12-19T09:36:26Z
Marie Lizak;Stellantis prend une décision décevante pour sa voiture électrique américaine aux 800 km d’autonomie;Leader des ventes de pick-up aux États-Unis, le Tesla Cybertruck a encore de beaux jours devant lui. Et pour cause, Stellantis annonce avoir reporté le lancement de son rival, le RAM 1500 REV, qui ne verra pas le jour avant 2026. Et on sait pourquoi.;https://www.frandroid.com/survoltes/voitures-electriques/2446056_stellantis-prend-une-decision-decevante-pour-sa-voiture-electrique-americaine-aux-800-km-dautonomie;2024-12-19T09:35:12Z
Tj Squires;Putting AI to the (Accessibility) Test;"Over the past few months, Tj Squires has been incorporating generative AI into his workflow as an Accessibility Engineer at TPGi, and there are three vital ways it has provided great aid.
The post Putting AI to the (Accessibility) Test appeared first on TPGi.";https://www.tpgi.com/putting-ai-to-the-accessibility-test/;2024-12-19T09:34:59Z
